{
  "schema_version": "2.0",
  "tool": {
    "name": "SF Analyzer",
    "version": "3.0.0",
    "generated_by": "SEOHead"
  },
  "run": {
    "project": "example.com",
    "input_mode": "parse-exports",
    "source": null,
    "exports_dir": "docs/examples/exports",
    "sf_version_detected": null,
    "generated_at": "2026-10-09T18:17:15Z",
    "profile": "full",
    "exports_used": [
      "internal_all",
      "inlinks_4xx"
    ],
    "exports_missing": [
      "resp_4xx",
      "resp_5xx",
      "resp_3xx",
      "resp_no_response",
      "resp_blocked",
      "inlinks_5xx",
      "inlinks_3xx",
      "all_inlinks",
      "sitemap_in",
      "sitemap_not_in",
      "sitemap_orphan",
      "sitemap_non_indexable",
      "sitemap_redirects",
      "sitemap_non_200",
      "images_missing_alt",
      "images_over_kb",
      "images_missing_size",
      "titles_duplicate",
      "titles_multiple",
      "hreflang",
      "all_hreflang",
      "desc_duplicate",
      "redirect_chains",
      "security_mixed",
      "security_hsts",
      "structured_data_missing"
    ],
    "exports_encodings": {
      "internal_all": "utf-8-sig",
      "inlinks_4xx": "utf-8-sig"
    },
    "crawl_valid": true,
    "crawl_invalid_reason": null,
    "requires_rendering": false,
    "crawl_partial": false,
    "checks_skipped": [
      {
        "id": "IMG_MISSING_ALT",
        "reason": "missing export: images_missing_alt"
      },
      {
        "id": "IMG_OVER_KB",
        "reason": "missing export: images_over_kb"
      },
      {
        "id": "IMG_MISSING_DIMENSIONS",
        "reason": "missing export: images_missing_size"
      },
      {
        "id": "MIXED_CONTENT",
        "reason": "missing export: security_mixed"
      },
      {
        "id": "MISSING_HSTS",
        "reason": "missing export: security_hsts"
      },
      {
        "id": "STRUCTURED_DATA_MISSING",
        "reason": "missing export: structured_data_missing"
      },
      {
        "id": "HREFLANG_ERROR",
        "reason": "missing export: hreflang"
      },
      {
        "id": "HREFLANG_BROKEN_TARGET",
        "reason": "missing export: all_hreflang"
      },
      {
        "id": "SITEMAP_URL_4XX_5XX",
        "reason": "missing export: sitemap_non_200"
      },
      {
        "id": "SITEMAP_URL_3XX",
        "reason": "missing export: sitemap_redirects"
      },
      {
        "id": "SITEMAP_URL_NON_INDEXABLE",
        "reason": "missing export: sitemap_non_indexable"
      },
      {
        "id": "BROKEN_BOOKMARK",
        "reason": "export input retains no HTML/DOM bodies; fragment targets are measured only from a native retained scan"
      },
      {
        "id": "DESC_MULTIPLE",
        "reason": "no meta description count evidence (native crawl only)"
      },
      {
        "id": "H2_MISSING",
        "reason": "requirements.require_h2 is false; the check was not evaluated"
      },
      {
        "id": "H1_ALT_TEXT_ONLY",
        "reason": "no H1 alt-text evidence (native crawl only)"
      },
      {
        "id": "HEADING_BEFORE_H1",
        "reason": "no heading outline evidence (native crawl only)"
      },
      {
        "id": "HEADING_IN_PAGE_CHROME",
        "reason": "no heading outline evidence (native crawl only)"
      },
      {
        "id": "HEADING_SKIP",
        "reason": "no heading outline evidence (native crawl only)"
      },
      {
        "id": "LINK_INSIDE_HEADING",
        "reason": "no link-placement evidence (native crawl only)"
      },
      {
        "id": "IMAGE_LINK_WITHOUT_TEXT",
        "reason": "no link-placement evidence (native crawl only)"
      },
      {
        "id": "META_KEYWORDS_PRESENT",
        "reason": "no Meta Keywords 1 column in Internal:All"
      },
      {
        "id": "PAGINATION_CANONICAL_POLICY",
        "reason": "no pagination canonical policy configured"
      },
      {
        "id": "FILTER_CANONICAL_POLICY",
        "reason": "no filters canonical policy configured"
      },
      {
        "id": "CONTENT_IN_IFRAME",
        "reason": "no iframe inventory in this evidence"
      },
      {
        "id": "SCHEMA_VALIDATION_ERROR",
        "reason": "no Structured Data validation columns in Internal:All"
      },
      {
        "id": "STRUCTURED_DATA_PARSE_ERROR",
        "reason": "no JSON-LD found/parsed block counts (native crawl only)"
      },
      {
        "id": "READABILITY_DIFFICULT",
        "reason": "no Readability/Flesch column"
      },
      {
        "id": "LONG_SENTENCES",
        "reason": "no Average Words Per Sentence column"
      },
      {
        "id": "SPELLING_ERRORS",
        "reason": "no Spelling Errors column (enable spell-check in SF)"
      },
      {
        "id": "GRAMMAR_ERRORS",
        "reason": "no Grammar Errors column (enable grammar-check in SF)"
      },
      {
        "id": "HTTP_REFRESH_REDIRECT",
        "reason": "no Refresh response header evidence (native crawl only)"
      },
      {
        "id": "CANONICAL_MULTIPLE",
        "reason": "no Canonical Link Element 2 column in Internal:All"
      },
      {
        "id": "PAGINATION_LOOP",
        "reason": "no rel=\"next\" column in Internal:All"
      },
      {
        "id": "UNLINKED_PAGINATION_SERIES",
        "reason": "no rel=\"next\" column in Internal:All"
      },
      {
        "id": "PAGINATION_SEQUENCE_ERROR",
        "reason": "no rel=\"next\" column in Internal:All"
      },
      {
        "id": "HTTP1_ONLY",
        "reason": "no HTTP Version column in Internal:All"
      },
      {
        "id": "AMPHTML_PRESENT",
        "reason": "no amphtml Link Element column in Internal:All"
      },
      {
        "id": "LOREM_IPSUM_PLACEHOLDER",
        "reason": "no Lorem Ipsum evidence (native crawl only)"
      },
      {
        "id": "UNSUPPORTED_PLUGIN",
        "reason": "no plugin-element evidence (native crawl only)"
      },
      {
        "id": "IMG_MISSING_ALT_ATTRIBUTE",
        "reason": "no per-image evidence (native crawl only)"
      },
      {
        "id": "IMG_ALT_TOO_LONG",
        "reason": "no per-image evidence (native crawl only)"
      },
      {
        "id": "AJAX_CRAWLING_SCHEME_URL",
        "reason": "no AJAX-scheme URL evidence (native crawl only)"
      },
      {
        "id": "AJAX_CRAWLING_SCHEME_META_FRAGMENT",
        "reason": "no <meta name=\"fragment\"> evidence (native crawl only)"
      },
      {
        "id": "MISSING_CHARSET",
        "reason": "no Meta Charset column, so a page without a header charset cannot be distinguished from one declaring <meta charset> (needs a native seohead crawl or Custom Extraction in SF)"
      },
      {
        "id": "MISSING_DOCTYPE",
        "reason": "no Doctype column (needs a native seohead crawl or Custom Extraction in SF)"
      },
      {
        "id": "VIEWPORT_MISSING",
        "reason": "no Viewport column (needs a native seohead crawl or Custom Extraction in SF)"
      },
      {
        "id": "NO_COMPRESSION",
        "reason": "no Content-Encoding column (needs a native seohead crawl or Custom Extraction in SF)"
      },
      {
        "id": "TITLE_OUTSIDE_HEAD",
        "reason": "no element-position evidence (needs a native seohead crawl; Screaming Frog has no notion of this on its own)"
      },
      {
        "id": "DESC_OUTSIDE_HEAD",
        "reason": "no element-position evidence (needs a native seohead crawl; Screaming Frog has no notion of this on its own)"
      },
      {
        "id": "CANONICAL_OUTSIDE_HEAD",
        "reason": "no element-position evidence (needs a native seohead crawl; Screaming Frog has no notion of this on its own)"
      },
      {
        "id": "DIRECTIVES_OUTSIDE_HEAD",
        "reason": "no element-position evidence (needs a native seohead crawl; Screaming Frog has no notion of this on its own)"
      },
      {
        "id": "HREFLANG_OUTSIDE_HEAD",
        "reason": "no element-position evidence (needs a native seohead crawl; Screaming Frog has no notion of this on its own)"
      },
      {
        "id": "HEAD_MISSING",
        "reason": "no element-position evidence (needs a native seohead crawl; Screaming Frog has no notion of this on its own)"
      },
      {
        "id": "HEAD_MULTIPLE",
        "reason": "no element-position evidence (needs a native seohead crawl; Screaming Frog has no notion of this on its own)"
      },
      {
        "id": "BODY_MISSING",
        "reason": "no element-position evidence (needs a native seohead crawl; Screaming Frog has no notion of this on its own)"
      },
      {
        "id": "BODY_MULTIPLE",
        "reason": "no element-position evidence (needs a native seohead crawl; Screaming Frog has no notion of this on its own)"
      },
      {
        "id": "INVALID_HEAD_ELEMENT",
        "reason": "no element-position evidence (needs a native seohead crawl; Screaming Frog has no notion of this on its own)"
      },
      {
        "id": "HEAD_NOT_FIRST",
        "reason": "no element-position evidence (needs a native seohead crawl; Screaming Frog has no notion of this on its own)"
      },
      {
        "id": "DUPLICATE_ID",
        "reason": "no duplicate-id evidence (native crawl only)"
      },
      {
        "id": "OG_MISSING",
        "reason": "no Open Graph columns in Internal:All (enable OG extraction in SF)"
      },
      {
        "id": "REDIRECT_CHAIN",
        "reason": "no redirect data (Internal:All has no Redirect URL column)"
      },
      {
        "id": "REDIRECT_LOOP",
        "reason": "no redirect data (Internal:All has no Redirect URL column)"
      },
      {
        "id": "TITLE_MULTIPLE",
        "reason": "no titles_multiple export (export this SF filter to enable)"
      },
      {
        "id": "LINK_TO_5XX",
        "reason": "export inlinks_5xx not available"
      },
      {
        "id": "BROKEN_EXTERNAL_LINK",
        "reason": "export inlinks_5xx not available"
      },
      {
        "id": "INTERNAL_LINK_TO_REDIRECT",